{"correction_binding":{"changed_fields":["percentage"],"corrected_relation":{"context_span":{"end":85,"start":0,"text":"Correction Table 1 / Group A / main cohort / N = 7 / count 2 / 28.6% instead of 28.5%"},"denominator_span":{"end":50,"start":45,"text":"N = 7"},"numerator_span":{"end":60,"start":59,"text":"2"},"object_locator_span":{"end":28,"start":21,"text":"Group A"},"percentage_span":{"end":68,"start":63,"text":"28.6%"},"scope_span":{"end":42,"start":21,"text":"Group A / main cohort"},"scope_status":"CUSTODIAN_CONFIRMED_SAME_SCOPE","table_locator_span":{"end":18,"start":11,"text":"Table 1"}},"mapping_status":"CUSTODIAN_CONFIRMED_EXACT_CORRECTION","old_value_spans":{"percentage":{"end":85,"start":80,"text":"28.5%"}},"statement_span":{"end":85,"start":0,"text":"Correction Table 1 / Group A / main cohort / N = 7 / count 2 / 28.6% instead of 28.5%"}},"correction_sha256":"626e3b26f1d541181f4b7097b871639cfffbf2df3842e5118773ba6d9b943756","correction_source_version":"corr-1","document_id":"doi:10.5555/synthetic-study","eligibility":"ELIGIBLE","objections":[],"relationship":{"context_span":{"end":57,"start":0,"text":"Table 1 / Group A / main cohort / N = 7 / count 2 / 28.5%"},"denominator_span":{"end":39,"start":34,"text":"N = 7"},"numerator_span":{"end":49,"start":48,"text":"2"},"object_locator_span":{"end":17,"start":10,"text":"Group A"},"percentage_span":{"end":57,"start":52,"text":"28.5%"},"scope_span":{"end":31,"start":10,"text":"Group A / main cohort"},"scope_status":"CUSTODIAN_CONFIRMED_SAME_SCOPE","table_locator_span":{"end":7,"start":0,"text":"Table 1"}},"review_id":"synthetic-review","role":"CORRECTION_POSITIVE","schema_version":"rw-custody-review/5","source_sha256":"4f62674d9d384715e4bc466a8cfa98f48c1c5333eb86b5168e1dc83d660913e1","source_version":"v1","source_version_status":"CUSTODIAN_CONFIRMED_SOURCE_VERSION"}
